機構名稱,所在縣市,健保特約類別,機構電話,機構地址,lat,long
國立臺灣大學醫學院附設醫院雲林分院,雲林縣,區域醫院,05-5323911,雲林縣斗六市雲林路二段579號 ,23.6975466,120.5259195
國立臺灣大學醫學院附設醫院虎尾分院,雲林縣,區域醫院,05-5323911,雲林縣虎尾鎮興中里興中360號,23.7213291,120.4370276
天主教若瑟醫療財團法人若瑟醫院,雲林縣,區域醫院,05-6337333,雲林縣虎尾鎮新生路74號,23.7080161,120.4373426
彰化基督教醫療財團法人雲林基督教醫院,雲林縣,區域醫院,05-5871111,雲林縣西螺鎮新豐里市場南路375號,23.7809585,120.4418958
中國醫藥大學北港附設醫院,雲林縣,區域醫院,05-7837901,雲林縣北港鎮新德路123號,23.590144,120.307229
長庚醫療財團法人嘉義長庚紀念醫院,嘉義縣,區域醫院,05-3621000,嘉義縣朴子市仁和里嘉朴路西段 8號,23.4619493,120.2829458
佛教慈濟醫療財團法人大林慈濟醫院,嘉義縣,區域醫院,05-2648000,嘉義縣大林鎮平林里民生路2號,23.596561,120.4571827
